"Authors","Author full names","Author(s) ID","Title","Year","Source title","Volume","Issue","Art. No.","Page start","Page end","Page count","Cited by","DOI","Link","Abstract","Author Keywords","Document Type","Publication Stage","Open Access","Source","EID"
"","","","24th International Conference on Medical Image Computing and Computer Assisted Intervention, MICCAI 2021","2021","Lecture Notes in Computer Science (including subseries Lecture Notes in Artificial Intelligence and Lecture Notes in Bioinformatics)","12902 LNCS","","","","","5669","0","","https://www.scopus.com/inward/record.uri?eid=2-s2.0-85116420317&partnerID=40&md5=194f8fbb9ea8e318f74235f15df14ce3","The proceedings contain 531 papers. The special focus in this conference is on Medical Image Computing and Computer Assisted Intervention. The topics include: TransBTS: Multimodal Brain Tumor Segmentation Using Transformer; automatic Polyp Segmentation via Multi-scale Subtraction Network; patch-Free 3D Medical Image Segmentation Driven by Super-Resolution Technique and Self-Supervised Guidance; progressively Normalized Self-Attention Network for Video Polyp Segmentation; SGNet: Structure-Aware Graph-Based Network for Airway Semantic Segmentation; NucMM Dataset: 3D Neuronal Nuclei Instance Segmentation at Sub-Cubic Millimeter Scale; AxonEM Dataset: 3D Axon Instance Segmentation of Brain Cortical Regions; improved Brain Lesion Segmentation with Anatomical Priors from Healthy Subjects; carveMix: A Simple Data Augmentation Method for Brain Lesion Segmentation; TransFuse: Fusing Transformers and CNNs for Medical Image Segmentation; boundary-Aware Transformers for Skin Lesion Segmentation; A Topological-Attention ConvLSTM Network and Its Application to EM Images; BiX-NAS: Searching Efficient Bi-directional Architecture for Medical Image Segmentation; multi-task, Multi-domain Deep Segmentation with Shared Representations and Contrastive Regularization for Sparse Pediatric Datasets; TEDS-Net: Enforcing Diffeomorphisms in Spatial Transformers to Guarantee Topology Preservation in Segmentations; learning Consistency- and Discrepancy-Context for 2D Organ Segmentation; partially-Supervised Learning for Vessel Segmentation in Ocular Images; unsupervised Network Learning for Cell Segmentation; MT-UDA: Towards Unsupervised Cross-modality Medical Image Segmentation with Limited Source Labels; context-Aware Virtual Adversarial Training for Anatomically-Plausible Segmentation; Pancreas CT Segmentation by Predictive Phenotyping; interactive Segmentation via Deep Learning and B-Spline Explicit Active Surfaces; multi-compound Transformer for Accurate Biomedical Image Segmentation; kCBAC-Net: Deeply Supervised Complete Bipartite Networks with Asymmetric Convolutions for Medical Image Segmentation; Refined Local-imbalance-based Weight for Airway Segmentation in CT.","","Conference review","Final","","Scopus","2-s2.0-85116420317"
"Tian M.; Yang Q.; Gao Y.","Tian, Mu (57222712119); Yang, Qinzhu (57485894400); Gao, Yi (58039670200)","57222712119; 57485894400; 58039670200","Multi-scale Multi-task Distillation for Incremental 3D Medical Image Segmentation","2023","Lecture Notes in Computer Science (including subseries Lecture Notes in Artificial Intelligence and Lecture Notes in Bioinformatics)","13803 LNCS","","","369","384","15","3","10.1007/978-3-031-25066-8_20","https://www.scopus.com/inward/record.uri?eid=2-s2.0-85151136392&doi=10.1007%2f978-3-031-25066-8_20&partnerID=40&md5=6e1c8a98c295a40a622b13eb9357fcd6","Automatic medical image segmentation is the core component for many clinical applications. Substantial number of deep learning based methods have been proposed in past years, but deploying such methods in practice faces certain difficulties, such as the acquisition of massive annotated data for training and the high latency of model iteration. In contrast to the conventional cycle of “data collection, offline training, model update”, developing a system that continuously generates robust predictions will be critical. Recently, incremental learning was widely investigated for classification and semantic segmentation on 2D natural images. Existing work showed the effectiveness of data rehearsal and knowledge distillation in counteracting catastrophic forgetting. Inspired by these advances, we propose a multi-scale multi-task distillation framework for incremental learning with 3D medical images. Different from the task-incremental scenario in literature, our proposed strategy focuses on improving robustness against implicit data distribution shift. We introduce knowledge distillation as multi-task regularization to resolve prediction confusions. At each step, the network is instructed to learn towards both the new ground truth and the uncertainty weighted predictions from the previous model. Simultaneously, image features at multiple scales in the segmentation network could participate in a contrastive learning scheme, aiming at more discriminant representations that inherit the past knowledge effectively. Experiments showed that our method improved overall continual learning robustness under the extremely challenging scenario of “seeing each image once in a batch of one” without any pre-training. In addition, the proposed method could work on top of any network architectures and existing incremental learning strategies. We also showed further improvements by combining our method with data rehearsal using a small buffer. © 2023, The Author(s), under exclusive license to Springer Nature Switzerland AG.","3D medical image segmentation; Distillation; Incremental learning; Multi-scale; Multi-task","Conference paper","Final","","Scopus","2-s2.0-85151136392"
"Chen Y.; Zhang L.; Chen B.; Zuo J.; Hu Y.","Chen, Yuyang (59383256600); Zhang, Li (58853352100); Chen, Bowei (56789262700); Zuo, Jian (58125423000); Hu, Yingwen (58984338500)","59383256600; 58853352100; 56789262700; 58125423000; 58984338500","MPG-Net: A Semantic Segmentation Model for Extracting Aquaculture Ponds in Coastal Areas from Sentinel-2 MSI and Planet SuperDove Images","2024","Remote Sensing","16","20","3760","","","","0","10.3390/rs16203760","https://www.scopus.com/inward/record.uri?eid=2-s2.0-85207371299&doi=10.3390%2frs16203760&partnerID=40&md5=f56570702910282b693dda3e70afc756","Achieving precise and swift monitoring of aquaculture ponds in coastal regions is essential for the scientific planning of spatial layouts in aquaculture zones and the advancement of ecological sustainability in coastal areas. However, because the distribution of many land types in coastal areas and the complex spectral features of remote sensing images are prone to the phenomenon of ‘same spectrum heterogeneous objects’, the current deep learning model is susceptible to background noise interference in the face of complex backgrounds, resulting in poor model generalization ability. Moreover, with the image features of aquaculture ponds of different scales, the model has limited multi-scale feature extraction ability, making it difficult to extract effective edge features. To address these issues, this work suggests a novel semantic segmentation model for aquaculture ponds called MPG-Net, which is based on an enhanced version of the U-Net model and primarily comprises two structures: MS and PGC. The MS structure integrates the Inception module and the Dilated residual module in order to enhance the model’s ability to extract the features of aquaculture ponds and effectively solve the problem of gradient disappearance in the training of the model; the PGC structure integrates the Global Context module and the Polarized Self-Attention in order to enhance the model’s ability to understand the contextual semantic information and reduce the interference of redundant information. Using Sentinel-2 and Planet images as data sources, the effectiveness of the refined method is confirmed through ablation experiments conducted on the two structures. The experimental comparison using the FCN8S, SegNet, U-Net, and DeepLabV3 classical semantic segmentation models shows that the MPG-Net model outperforms the other four models in all four precision evaluation indicators; the average values of precision, recall, IoU, and F1-Score of the two image datasets with different resolutions are 94.95%, 92.95%, 88.57%, and 93.94%, respectively. These values prove that the MPG-Net model has better robustness and generalization ability, which can reduce the interference of irrelevant information, effectively improve the extraction precision of individual aquaculture ponds, and significantly reduce the edge adhesion of aquaculture ponds in the extraction results, thereby offering new technical support for the automatic extraction of aquaculture ponds in coastal areas. © 2024 by the authors.","aquaculture pond; deep learning; MPG-Net; remote sensing image; segmentation","Article","Final","All Open Access; Gold Open Access","Scopus","2-s2.0-85207371299"
"","","","24th International Conference on Medical Image Computing and Computer Assisted Intervention, MICCAI 2021","2021","Lecture Notes in Computer Science (including subseries Lecture Notes in Artificial Intelligence and Lecture Notes in Bioinformatics)","12901 LNCS","","","","","5669","0","","https://www.scopus.com/inward/record.uri?eid=2-s2.0-85116441624&partnerID=40&md5=e7672c0f93dc15cd4ea5b09542cb770b","The proceedings contain 531 papers. The special focus in this conference is on Medical Image Computing and Computer Assisted Intervention. The topics include: TransBTS: Multimodal Brain Tumor Segmentation Using Transformer; automatic Polyp Segmentation via Multi-scale Subtraction Network; patch-Free 3D Medical Image Segmentation Driven by Super-Resolution Technique and Self-Supervised Guidance; progressively Normalized Self-Attention Network for Video Polyp Segmentation; SGNet: Structure-Aware Graph-Based Network for Airway Semantic Segmentation; NucMM Dataset: 3D Neuronal Nuclei Instance Segmentation at Sub-Cubic Millimeter Scale; AxonEM Dataset: 3D Axon Instance Segmentation of Brain Cortical Regions; improved Brain Lesion Segmentation with Anatomical Priors from Healthy Subjects; carveMix: A Simple Data Augmentation Method for Brain Lesion Segmentation; TransFuse: Fusing Transformers and CNNs for Medical Image Segmentation; boundary-Aware Transformers for Skin Lesion Segmentation; A Topological-Attention ConvLSTM Network and Its Application to EM Images; BiX-NAS: Searching Efficient Bi-directional Architecture for Medical Image Segmentation; multi-task, Multi-domain Deep Segmentation with Shared Representations and Contrastive Regularization for Sparse Pediatric Datasets; TEDS-Net: Enforcing Diffeomorphisms in Spatial Transformers to Guarantee Topology Preservation in Segmentations; learning Consistency- and Discrepancy-Context for 2D Organ Segmentation; partially-Supervised Learning for Vessel Segmentation in Ocular Images; unsupervised Network Learning for Cell Segmentation; MT-UDA: Towards Unsupervised Cross-modality Medical Image Segmentation with Limited Source Labels; context-Aware Virtual Adversarial Training for Anatomically-Plausible Segmentation; Pancreas CT Segmentation by Predictive Phenotyping; interactive Segmentation via Deep Learning and B-Spline Explicit Active Surfaces; multi-compound Transformer for Accurate Biomedical Image Segmentation; kCBAC-Net: Deeply Supervised Complete Bipartite Networks with Asymmetric Convolutions for Medical Image Segmentation; Refined Local-imbalance-based Weight for Airway Segmentation in CT.","","Conference review","Final","","Scopus","2-s2.0-85116441624"
"Li Y.; Yan Q.; Zhang K.; Xu H.","Li, Yuenan (55145899000); Yan, Qixin (57221106534); Zhang, Kuangshi (57221086457); Xu, Haoyu (57222574816)","55145899000; 57221106534; 57221086457; 57222574816","Image Reflection Removal via Contextual Feature Fusion Pyramid and Task-Driven Regularization","2022","IEEE Transactions on Circuits and Systems for Video Technology","32","2","","553","565","12","12","10.1109/TCSVT.2021.3067502","https://www.scopus.com/inward/record.uri?eid=2-s2.0-85103242945&doi=10.1109%2fTCSVT.2021.3067502&partnerID=40&md5=c463498c5c72bfaf7072297383395104","In this paper, we propose a deep neural network for single image reflection removal. More specifically, we design a convolutional-grid module and take it as the building block of a feature fusion pyramid. The module leverages the combination effect of the grid topology to create a rich ensemble of receptive fields. Embedding the modules into a pyramidal architecture further expands the coverage of receptive fields. Another benefit of the pyramid is to fuse the multi-scale features learned by the modules locating at the ascending and descending pathways. The rich diversity of features helps the neural network analyze the contexts around overlapping objects at various spatial ranges and harvest the cues for layer separation. The proposed work also exploits useful semantic cues from the hyper-column descriptors generated by a pre-trained VGG-19 model to reduce the ambiguity of layer separation. In light of the low correlation between background and reflection layers, we design a channel-correlation based conditional discriminator to penalize residual reflection. The discriminator uses channel-wise attention to screen the features that can distinguish real background images from estimated ones. This paper also presents a task-driven regularization strategy. The high sensitivity of semantic segmentation to reflection is exploited for assessing the completeness of reflection removal. Training with this regularization strategy can boost the performance of both reflection removal and high-level task. The comparison against state-of-the-art algorithms on four public benchmark datasets demonstrates that this work exhibits superior performance in handling the complex reflections in wild scenarios. The proposed network architecture is also applicable to haze removal, which is another ill-posed layer separation problem, and has shown encouraging performance. © 2021 IEEE.","Feature fusion; Multi-scale feature extraction; Reflection removal; Semantic segmentation; Task-driven regularization","Article","Final","","Scopus","2-s2.0-85103242945"
"Dai Y.; Zhao K.; Shen L.; Liu S.; Yan X.; Li Z.","Dai, Yanshuai (57195476834); Zhao, Kongyang (57223180857); Shen, Li (36555006600); Liu, Shichuan (58303612400); Yan, Xin (57202610950); Li, Zhilin (7409077661)","57195476834; 57223180857; 36555006600; 58303612400; 57202610950; 7409077661","A Siamese Network Combining Multiscale Joint Supervision and Improved Consistency Regularization for Weakly Supervised Building Change Detection","2023","IEEE Journal of Selected Topics in Applied Earth Observations and Remote Sensing","16","","","4963","4982","19","8","10.1109/JSTARS.2023.3279863","https://www.scopus.com/inward/record.uri?eid=2-s2.0-85161040277&doi=10.1109%2fJSTARS.2023.3279863&partnerID=40&md5=b9870cfa8e377d24a855f5be4d3a52fd","Building change detection (BCD) from remote sensing images is essential in various practical applications. Recently, inspired by the achievement of deep learning in semantic segmentation (SS), methods that treat the BCD problem as a binary SS task using deep siamese networks have attracted increasing attention. However, similar to their counterparts, these approaches still face the challenge of collecting massive pixel-level annotations. To address this issue, this article presents a novel weakly supervised method for BCD from remote sensing images using image-level labels. The proposed method elaborately designs a siamese network to integrate a multiscale joint supervision (MJS) module and an improved consistency regularization (ICR) module into a unified framework to improve the so-called class activation maps (CAMs), which is vital for producing high-quality pseudomasks using image-level annotations to support pixel-level BCD. To be specific, the MSJ is used for generating refined multiscale CAMs to well capture changes at different scales corresponding to various buildings of varying sizes. The ICR contributes to improving the consistency of CAMs to highlight the boundaries of changed buildings. Extensive experiments on two public BCD datasets have demonstrated that the proposed method outperforms the current state-of-the-art approaches. Furthermore, the visual detection maps also indicate that the proposed method can achieve scale-adaptive change detection results and preserve object boundaries more effectively.  © 2008-2012 IEEE.","Building change detection (BCD); class activation maps (CAM); image-level weakly supervised; improved consistency regularization (ICR); multiscale joint supervision (MJS)","Article","Final","All Open Access; Gold Open Access","Scopus","2-s2.0-85161040277"
"Liao Y.; Kang S.; Li J.; Liu Y.; Liu Y.; Dong Z.; Yang B.; Chen X.","Liao, Youqi (58186083600); Kang, Shuhao (58289190100); Li, Jianping (57191420252); Liu, Yang (57997357000); Liu, Yun (57191434431); Dong, Zhen (55578187900); Yang, Bisheng (55578807789); Chen, Xieyuanli (57193685774)","58186083600; 58289190100; 57191420252; 57997357000; 57191434431; 55578187900; 55578807789; 57193685774","Mobile-Seed: Joint Semantic Segmentation and Boundary Detection for Mobile Robots","2024","IEEE Robotics and Automation Letters","9","4","","3902","3909","7","4","10.1109/LRA.2024.3373235","https://www.scopus.com/inward/record.uri?eid=2-s2.0-85187383375&doi=10.1109%2fLRA.2024.3373235&partnerID=40&md5=410e02773594da21c63fcedf7a75482f","Precise and rapid delineation of sharp boundaries and robust semantics is essential for numerous downstream robotic tasks, such as robot grasping and manipulation, real-time semantic mapping, and online sensor calibration performed on edge computing units. Although boundary detection and semantic segmentation are complementary tasks, most studies focus on lightweight models for semantic segmentation but overlook the critical role of boundary detection. In this work, we introduce Mobile-Seed, a lightweight, dual-task framework tailored for simultaneous semantic segmentation and boundary detection. Our framework features a two-stream encoder, an active fusion decoder (AFD) and a dual-task regularization approach. The encoder is divided into two pathways: one captures category-aware semantic information, while the other discerns boundaries from multi-scale features. The AFD module dynamically adapts the fusion of semantic and boundary information by learning channel-wise relationships, allowing for precise weight assignment of each channel. Furthermore, we introduce a regularization loss to mitigate the conflicts in dual-task learning and deep diversity supervision. Compared to existing methods, the proposed Mobile-Seed offers a lightweight framework to simultaneously improve semantic segmentation performance and accurately locate object boundaries. Experiments on the Cityscapes dataset have shown that Mobile-Seed achieves notable improvement over the state-of-the-art (SOTA) baseline by 2.2 percentage points (pp) in mIoU and 4.2 pp in mF-score, while maintaining an online inference speed of 23.9 frames-per-second (FPS) with 1024 × 2048 resolution input on an RTX 2080 Ti GPU. Additional experiments on CamVid and PASCAL Context datasets confirm our method's generalizability. © 2016 IEEE.","Deep learning for visual perception; deep learning methods; visual learning","Article","Final","All Open Access; Green Open Access","Scopus","2-s2.0-85187383375"
"Yang L.; Gu X.; Sun J.","Yang, Liwei (57226598496); Gu, Xiang (57219182794); Sun, Jian (57650520100)","57226598496; 57219182794; 57650520100","Generalized Semantic Segmentation by Self-Supervised Source Domain Projection and Multi-Level Contrastive Learning","2023","Proceedings of the 37th AAAI Conference on Artificial Intelligence, AAAI 2023","37","","","10789","10797","8","3","10.1609/aaai.v37i9.26280","https://www.scopus.com/inward/record.uri?eid=2-s2.0-85168250939&doi=10.1609%2faaai.v37i9.26280&partnerID=40&md5=8b280c090eb91e93dcaf629b1b240416","Deep networks trained on the source domain show degraded performance when tested on unseen target domain data. To enhance the model’s generalization ability, most existing domain generalization methods learn domain invariant features by suppressing domain sensitive features. Different from them, we propose a Domain Projection and Contrastive Learning (DPCL) approach for generalized semantic segmentation, which includes two modules: Self-supervised Source Domain Projection (SSDP) and Multi-Level Contrastive Learning (MLCL). SSDP aims to reduce domain gap by projecting data to the source domain, while MLCL is a learning scheme to learn discriminative and generalizable features on the projected data. During test time, we first project the target data by SSDP to mitigate domain shift, then generate the segmentation results by the learned segmentation network based on MLCL. At test time, we can update the projected data by minimizing our proposed pixel-to-pixel contrastive loss to obtain better results. Extensive experiments for semantic segmentation demonstrate the favorable generalization capability of our method on benchmark datasets. Copyright © 2023, Association for the Advancement of Artificial Intelligence (www.aaai.org). All rights reserved.","","Conference paper","Final","All Open Access; Gold Open Access; Green Open Access","Scopus","2-s2.0-85168250939"
"Li B.; Gong A.; Zhang J.; Fu Z.","Li, Boyi (57394440600); Gong, Adu (24536867900); Zhang, Jiaming (59215645400); Fu, Zexin (59216159300)","57394440600; 24536867900; 59215645400; 59216159300","From image-level to pixel-level labeling: A weakly-supervised learning method for identifying aquaculture ponds using iterative anti-adversarial attacks guided by aquaculture features","2024","International Journal of Applied Earth Observation and Geoinformation","132","","104023","","","","0","10.1016/j.jag.2024.104023","https://www.scopus.com/inward/record.uri?eid=2-s2.0-85198370124&doi=10.1016%2fj.jag.2024.104023&partnerID=40&md5=bed3802af6d90947f5d5cd112fef85d9","Aquaculture mapping is essential for monitoring and managing aquaculture resources. However, accurately geotargeting individual aquaculture ponds from medium-resolution remote sensing imagery remains challenging, and convolutional deep learning methods for identifying aquaculture ponds require labor-intensive pixel-level annotations. This paper presents a novel weakly-supervised learning method to derive pixel-level labels from image-level annotations for aquaculture ponds. Our approach uses iterative anti-adversarial attacks to refine localization results from multi-scale class activation maps (CAMs). The improved method integrates two regularization methods guided by aquaculture features to form a joint loss function for adversarial samples: discriminative water region suppression and non-aquaculture water class suppression. We also propose an aquaculture feature termed CFNDWI to constrain the localization results and generate high-quality pseudo-labels. As a result, the pseudo-labels are used to train semantic segmentation networks for accurately identifying aquaculture ponds. We evaluated the performance of our method using commonly-used backbones on 10 m Sentinel-2 imagery. Our method achieves Intersection over Union (IoU) values of 0.618–0.655 for pseudo-label generation, and IoU values of 0.664–0.708 for semantic segmentation, outperforming state-of-the-art weakly-supervised methods and public datasets. The effectiveness of each module of our method was also testified through ablation experiments. Our method leverages knowledge-driven aquaculture features to guide the data-driven adversarial learning process, addressing the lack of high-quality aquaculture datasets for model training. The code for implementing our method will be accessible at https://github.com/designer1024/WSLM-AQ. © 2024 The Authors","Adversarial learning; Aquaculture pond; Class activation map; Pseudo-label; Weakly-supervised learning","Article","Final","","Scopus","2-s2.0-85198370124"
