"Authors","Author full names","Author(s) ID","Title","Year","Source title","Volume","Issue","Art. No.","Page start","Page end","Page count","Cited by","DOI","Link","Abstract","Author Keywords","Document Type","Publication Stage","Open Access","Source","EID"
"","","","21st International Conference on Image Analysis and Processing, ICIAP 2022","2022","Lecture Notes in Computer Science (including subseries Lecture Notes in Artificial Intelligence and Lecture Notes in Bioinformatics)","13233 LNCS","","","","","2040","0","","https://www.scopus.com/inward/record.uri?eid=2-s2.0-85131156934&partnerID=40&md5=da694c2bf2b4a4cf0ff415d80c89905e","The proceedings contain 168 papers. The special focus in this conference is on Image Analysis and Processing. The topics include: Leveraging Road Area Semantic Segmentation with Auxiliary Steering Task; Pulmonary-Restricted COVID-19 Informative Visual Screening Using Chest X-ray Images from Portable Devices; unsupervised Multi-camera Domain Adaptation for Object Detection in Cultural Sites; automatic Classification of Fresco Fragments: A Machine and Deep Learning Study; The AIRES-CH Project: Artificial Intelligence for Digital REStoration of Cultural Heritages Using Nuclear Imaging and Multidimensional Adversarial Neural Networks; Grad 2 VAE: An Explainable Variational Autoencoder Model Based on Online Attentions Preserving Curvatures of Representations; pruning in the Face of Adversaries; Towards Latent Space Optimization of GANs Using Meta-Learning; DMSANet: Dual Multi Scale Attention Network; enhanced Data-Recalibration: Utilizing Validation Data to Mitigate Instance-Dependent Noise in Classification; a Comparison of Deep Learning Methods for Inebriation Recognition in Humans; contrastive Supervised Distillation for Continual Representation Learning; multiple Input Branches Shift Graph Convolutional Network with DropEdge for Skeleton-Based Action Recognition; Robust Object Detection with Multi-input Multi-output Faster R-CNN; don’t Wait Until the Accident Happens: Few-Shot Classification Framework for Car Accident Inspection in a Real World; CVGAN: Image Generation with Capsule Vector-VAE; Avalanche RL: A Continual Reinforcement Learning Library; towards an Efficient Facial Image Compression with Neural Networks; consistency Regularization for Unsupervised Domain Adaptation in Semantic Segmentation; medicinal Boxes Recognition on a Deep Transfer Learning Augmented Reality Mobile Application; towards Efficient and Data Agnostic Image Classification Training Pipeline for Embedded Systems; an Intelligent Scanning Vehicle for Waste Collection Monitoring; avoiding Shortcuts in Unpaired Image-to-Image Translation.","","Conference review","Final","","Scopus","2-s2.0-85131156934"
"Liu Y.; Zhang Y.; Wang Y.; Mei S.","Liu, Yuheng (57937822000); Zhang, Yifan (58747629100); Wang, Ye (59295669000); Mei, Shaohui (25822578400)","57937822000; 58747629100; 59295669000; 25822578400","Rethinking Transformers for Semantic Segmentation of Remote Sensing Images","2023","IEEE Transactions on Geoscience and Remote Sensing","61","","5617515","","","","48","10.1109/TGRS.2023.3302024","https://www.scopus.com/inward/record.uri?eid=2-s2.0-85166767925&doi=10.1109%2fTGRS.2023.3302024&partnerID=40&md5=781fefb001e5d235d7452a09b510f153","Transformer has been widely applied in image processing tasks as a substitute for convolutional neural networks (CNNs) for feature extraction due to its superiority in global context modeling and flexibility in model generalization. However, the existing transformer-based methods for semantic segmentation of remote sensing (RS) images are still with several limitations, which can be summarized into two main aspects: 1) the transformer encoder is generally combined with CNN-based decoder, leading to inconsistency in feature representations; and 2) the strategies for global and local context information utilization are not sufficiently effective. Therefore, in this article, a global-local transformer segmentor (GLOTS) framework is proposed for the semantic segmentation of RS images to acquire consistent feature representations by adopting transformers for both encoding and decoding, in which a masked image modeling (MIM) pretrained transformer encoder is adopted to learn semantic-rich representations of input images and a multiscale global-local transformer decoder is designed to fully exploit the global and local features. Specifically, the transformer decoder uses a feature separation-aggregation module (FSAM) to utilize the feature adequately at different scales and adopts a global-local attention module (GLAM) containing global attention block (GAB) and local attention block (LAB) to capture the global and local context information, respectively. Furthermore, a learnable progressive upsampling strategy (LPUS) is proposed to restore the resolution progressively, which can flexibly recover the fine-grained details in the upsampling process. The experiment results on the three benchmark RS datasets demonstrate that the proposed GLOTS is capable of achieving better performance with some state-of-the-art methods, and the superiority of the proposed framework is also verified by ablation studies. The code will be available at https://github.com/lyhnsn/GLOTS.  © 1980-2012 IEEE.","Encoder-decoder structure; global-local transformer; remote sensing (RS); semantic segmentation","Article","Final","","Scopus","2-s2.0-85166767925"
"Tao C.; Meng Y.; Li J.; Yang B.; Hu F.; Li Y.; Cui C.; Zhang W.","Tao, Chongxin (57224219625); Meng, Yizhuo (57206468834); Li, Junjie (57224222967); Yang, Beibei (57216704141); Hu, Fengmin (57206468334); Li, Yuanxi (57429376600); Cui, Changlu (57196024192); Zhang, Wen (56224552600)","57224219625; 57206468834; 57224222967; 57216704141; 57206468334; 57429376600; 57196024192; 56224552600","MSNet: multispectral semantic segmentation network for remote sensing images","2022","GIScience and Remote Sensing","59","1","","1177","1198","21","22","10.1080/15481603.2022.2101728","https://www.scopus.com/inward/record.uri?eid=2-s2.0-85135455948&doi=10.1080%2f15481603.2022.2101728&partnerID=40&md5=84cbc21d0e3d34aa1c13b752822c5071","In the research of automatic interpretation of remote sensing images, semantic segmentation based on deep convolutional neural networks has been rapidly developed and applied, and the feature segmentation accuracy and network model generalization ability have been gradually improved. However, most of the network designs are mainly oriented to the three visible RGB bands of remote sensing images, aiming to be able to directly borrow the mature natural image semantic segmentation networks and pre-trained models, but simultaneously causing the waste and loss of spectral information in the invisible light bands such as near-infrared (NIR) of remote sensing images. Combining the advantages of multispectral data in distinguishing typical features such as water and vegetation, we propose a novel deep neural network structure called the multispectral semantic segmentation network (MSNet) for semantic segmentation of multi-classified feature scenes. The multispectral remote sensing image bands are split into two groups, visible and invisible, and ResNet-50 is used for feature extraction in both coding stages, and cascaded upsampling is used to recover feature map resolution in the decoding stage, and the multi-scale image features and spectral features from the upsampling process are fused layer by layer using the feature pyramid structure to finally obtain semantic segmentation results. The training and validation results on two publicly available datasets show that MSNet has competitive performance. The code is available: https://github.com/taochx/MSNet. © 2022 The Author(s). Published by Informa UK Limited, trading as Taylor & Francis Group.","feature fusion; Multispectral remote sensing images; semantic segmentation; spectral feature","Article","Final","All Open Access; Gold Open Access","Scopus","2-s2.0-85135455948"
"Yang Z.-X.; You Z.-H.; Chen S.-B.; Tang J.; Luo B.","Yang, Zi-Xiong (58571587400); You, Zhi-Hui (57804166100); Chen, Si-Bao (9734673000); Tang, Jin (24286986300); Luo, Bin (57203411639)","58571587400; 57804166100; 9734673000; 24286986300; 57203411639","Semisupervised Edge-Aware Road Extraction via Cross Teaching between CNN and Transformer","2023","IEEE Journal of Selected Topics in Applied Earth Observations and Remote Sensing","16","","","8353","8362","9","5","10.1109/JSTARS.2023.3310612","https://www.scopus.com/inward/record.uri?eid=2-s2.0-85170558408&doi=10.1109%2fJSTARS.2023.3310612&partnerID=40&md5=4c1c9a8c6770f4a5119212758f1200de","Semisupervised semantic segmentation of remote sensing images has been proven to be an effective approach to reduce manual annotation costs and leverage available unlabeled data to improve segmentation performance. However, some existing methods that focus on self-training and consistent regularization fail to consider large-scale characteristics of remote sensing images and the importance of incorporating road edge information. In this article, we propose a novel semisupervised edge-aware network (SSEANet) for remote sensing image semantic segmentation by jointly training convolutional neural network and transformer. SSEANet focuses on the consistency loss of multiscale features and uses an attention mechanism to fuse road edge information. Extensive experiments on DeepGlobe, Massachusetts, and AerialKITTI-Bavaria datasets show that the proposed method outperforms state-of-the-art, demonstrating its effectiveness. © 2008-2012 IEEE.","Cross teaching (CT); edge-aware; road extraction; semisupervised learning; transformer","Article","Final","All Open Access; Gold Open Access","Scopus","2-s2.0-85170558408"
"Li B.; Sun K.; Lang Y.; Guan L.; Lu F.; Zhu Y.","Li, Benliang (56129844300); Sun, Keyang (57225952075); Lang, Yao (57750918100); Guan, Lan (57215054765); Lu, Fei (58587543400); Zhu, Yi (58440060200)","56129844300; 57225952075; 57750918100; 57215054765; 58587543400; 58440060200","Application of CSGE-PSPnet Remote Sensing Image Semantic Segmentation Technology in Transmission and Transformation Engineering Design","2022","Proceedings - 2022 Asian Conference on Frontiers of Power and Energy, ACFPE 2022","","","","85","89","4","0","10.1109/ACFPE56003.2022.9952233","https://www.scopus.com/inward/record.uri?eid=2-s2.0-85143796067&doi=10.1109%2fACFPE56003.2022.9952233&partnerID=40&md5=968a2f17bf930da6d061c12cb8a789f2","With the breakthrough development of remote sensing technology and deep learning, remote sensing technology also has a broad application prospect in the field of transmission and transformation engineering design. Semantic segmentation, as a key link in remote sensing image processing, is the basis for improving the intelligence of transmission and substation engineering, for siting, construction, maintenance, and monitoring of transmission and substation engineering by accurately identifying important facilities, sensitive locations and environmental changes. Therefore, this paper proposes a remote sensing image semantic segmentation model(CSGE-PSPnet), which is based on PSPNet(Pyramid Scene Parsing Network) and SGE(Spatial Group-Wise Enhance Attention). CSGE-PSPnet could enhance local significance features while extracting global features, realizes the refined extraction of key information, and designs CSGE Block(Spatial-Channel Group-Wise Enhance Attention) to extract channel and spatial local information at the same time to enhance local significance features. Multi-level features are fused through dense connection structures to retain feature information of small-scale targets. Subsequently, the deep global features are mined by PSPNet on the feature map after fusion, and the contextual information of different regions is fused to obtain the segmentation results. In addition, one auxiliary loss layer and one major loss layer further improve the model's generalization ability. The experimental results show that CSGE-PSPnet is superior to other methods and can accurately identify small targets, and CSGE Block significantly enhances the feature representation.  © 2022 IEEE.","mix domain attention; power transmission and transformation engineering; PSPNet; semantic segmentation of remote sensing images; site selection","Conference paper","Final","","Scopus","2-s2.0-85143796067"
"Kannadaguli P.","Kannadaguli, Prashanth (56656540700)","56656540700","YOLO v4 Based Human Detection System Using Aerial Thermal Imaging for UAV Based Surveillance Applications","2020","2020 International Conference on Decision Aid Sciences and Application, DASA 2020","","","9317198","1213","1219","6","34","10.1109/DASA51403.2020.9317198","https://www.scopus.com/inward/record.uri?eid=2-s2.0-85100549065&doi=10.1109%2fDASA51403.2020.9317198&partnerID=40&md5=157773091b6ac0e839ac4b8d871b2d9d","This work is related to building a Human Detection system based on You Only Look Once (YOLO) v4. It is one of the most recent Deep Learning approaches primitively built using single shot detection proposal. Unlike the double stage region-based object detection schemes this technique do not follow semantic segmentation, it does not undergo loss of the object information such as disappearance of the gradients and it does not require pre-defined anchors. This technique comprises strong feature extractors and reinforce multi scale object detection and it is very quick in the multi-threaded GPU environments. Since our fundamental research is concentrated on object classification related to Unmanned Aerial Vehicle (UAV) applications, as a first step we choose to detect the humans from thermal dataset. Therefore, we used thermal images and videos possessed from thermal cameras of UAV 1m to 50m above ground level as our dataset in building the model and testing. The YOLO v4 uses ground truth bounding boxes to extract the features like Weighted Residual Connections (WRC), Cross Stage Partial Connections (CSP), Cross mini Batch Normalization (CmBN), Self-Adversarial Training (SAT), Mish Activation (MA), Mosaic Data Augmentation (MDA) and Drop Block Regularization (DBR). Finally, the performance analysis of these model in terms of mean Average Precision (mAP) indicates that the modelling using YOLO v4 performs in a promising way and it can be used in automatic human detection systems. © 2020 IEEE.","Deep Learning; Object Detection; Smart City; Surveillance; Thermal Imaging; UAV; YOLO v4","Conference paper","Final","","Scopus","2-s2.0-85100549065"
"","","","21st International Conference on Image Analysis and Processing, ICIAP 2022","2022","Lecture Notes in Computer Science (including subseries Lecture Notes in Artificial Intelligence and Lecture Notes in Bioinformatics)","13232 LNCS","","","","","2040","0","","https://www.scopus.com/inward/record.uri?eid=2-s2.0-85130960916&partnerID=40&md5=dd1d0cdc6839a35ffe0f7e5c3c6b4fdd","The proceedings contain 168 papers. The special focus in this conference is on Image Analysis and Processing. The topics include: Leveraging Road Area Semantic Segmentation with Auxiliary Steering Task; Pulmonary-Restricted COVID-19 Informative Visual Screening Using Chest X-ray Images from Portable Devices; unsupervised Multi-camera Domain Adaptation for Object Detection in Cultural Sites; automatic Classification of Fresco Fragments: A Machine and Deep Learning Study; The AIRES-CH Project: Artificial Intelligence for Digital REStoration of Cultural Heritages Using Nuclear Imaging and Multidimensional Adversarial Neural Networks; Grad 2 VAE: An Explainable Variational Autoencoder Model Based on Online Attentions Preserving Curvatures of Representations; pruning in the Face of Adversaries; Towards Latent Space Optimization of GANs Using Meta-Learning; DMSANet: Dual Multi Scale Attention Network; enhanced Data-Recalibration: Utilizing Validation Data to Mitigate Instance-Dependent Noise in Classification; a Comparison of Deep Learning Methods for Inebriation Recognition in Humans; contrastive Supervised Distillation for Continual Representation Learning; multiple Input Branches Shift Graph Convolutional Network with DropEdge for Skeleton-Based Action Recognition; Robust Object Detection with Multi-input Multi-output Faster R-CNN; don’t Wait Until the Accident Happens: Few-Shot Classification Framework for Car Accident Inspection in a Real World; CVGAN: Image Generation with Capsule Vector-VAE; Avalanche RL: A Continual Reinforcement Learning Library; towards an Efficient Facial Image Compression with Neural Networks; consistency Regularization for Unsupervised Domain Adaptation in Semantic Segmentation; medicinal Boxes Recognition on a Deep Transfer Learning Augmented Reality Mobile Application; towards Efficient and Data Agnostic Image Classification Training Pipeline for Embedded Systems; an Intelligent Scanning Vehicle for Waste Collection Monitoring; avoiding Shortcuts in Unpaired Image-to-Image Translation.","","Conference review","Final","","Scopus","2-s2.0-85130960916"
"Chen Y.; He G.; Yin R.; Zheng K.; Wang G.","Chen, Yanlin (57984018900); He, Guojin (14028364400); Yin, Ranyu (57203751769); Zheng, Kaiyuan (57983778200); Wang, Guizhou (36519783300)","57984018900; 14028364400; 57203751769; 57983778200; 36519783300","Comparative Study of Marine Ranching Recognition in Multi-Temporal High-Resolution Remote Sensing Images Based on DeepLab-v3+ and U-Net","2022","Remote Sensing","14","22","5654","","","","15","10.3390/rs14225654","https://www.scopus.com/inward/record.uri?eid=2-s2.0-85142689637&doi=10.3390%2frs14225654&partnerID=40&md5=e4dac3773f3cd232cb8b7fb92e1688f3","The recognition and monitoring of marine ranching help to determine the type, spatial distribution and dynamic change of marine life, as well as promote the rational utilization of marine resources and marine ecological environment protection, which has important research significance and application value. In the study of marine ranching recognition based on high-resolution remote sensing images, the convolutional neural network (CNN)-based deep learning method, which can adapt to different water environments, can be used to identify multi-scale targets and restore the boundaries of extraction results with high accuracy. However, research based on deep learning still has problems such as rarely considering the feature complexity of marine ranching and inadequate discussion of model generalization for multi-temporal images. In this paper, we construct a multi-temporal dataset that describes multiple features of marine ranching to explore the recognition and generalization ability of the semantic segmentation models DeepLab-v3+ and U-Net (used in large-area marine ranching) based on GF-1 remote sensing images with a 2 m spatial resolution. Through experiments, we find that the F-score of the U-Net extraction results from multi-temporal test images is basically stable at more than 90%, while the F-score of DeepLab-v3+ fluctuates around 80%. The results show that, compared with DeepLab-v3+, U-Net has a stronger recognition and generalization ability for marine ranching. U-Net can identify floating raft aquaculture areas at different growing stages and distinguish between cage aquaculture areas with different colors but similar morphological characteristics. © 2022 by the authors.","deep learning; DeepLab-v3+; marine ranching; multi-temporal high-resolution remote sensing images; semantic segmentation; U-Net","Article","Final","All Open Access; Gold Open Access","Scopus","2-s2.0-85142689637"
"Wang Z.; Guo J.; Huang W.; Zhang S.","Wang, Zhen (57226052226); Guo, Jianxin (57196261924); Huang, Wenzhun (55570643700); Zhang, Shanwen (55713521800)","57226052226; 57196261924; 55570643700; 55713521800","Side-Scan Sonar Image Segmentation Based on Multi-Channel Fusion Convolution Neural Networks","2022","IEEE Sensors Journal","22","6","","5911","5928","17","29","10.1109/JSEN.2022.3149841","https://www.scopus.com/inward/record.uri?eid=2-s2.0-85124737080&doi=10.1109%2fJSEN.2022.3149841&partnerID=40&md5=5bc00e557ce13ee64e3aba97a2ce589d","Side-scan sonar is an important application in the field of ocean exploration. Accurate segmentation of target regions in side-scan sonar images is a challenging issue due to the low-resolution and strong noise interference. To accurately and faster segment the different categories target in sonar image, a novel convolutional neural networks (CNNs) model is proposed in this study. Firstly, the deep separable residual module is used for target regions multi-scale feature extraction and suppression noise feature information interference, and the multi-channel feature fusion method is used to enhance feature information transfer of convolution layers. Secondly, the adaptive supervised function is used for pixel-wise classification of different categories targets. Finally, to improve model generalization ability and robustness, the adaptive transfer learning method is introduced in the model training process. We have performed extensive experiments on side-scan sonar image with different targets and scales. The experimental results show that the detection accuracy of the proposed method reaches 95.73%, which is outperforms other state-of-the-art methods on the side-scan sonar image segmentation tasks. Moreover, the method has fewer computational parameters, facilitating future deployment it to underwater mobile detection devices.  © 2001-2012 IEEE.","adaptive supervised function; adaptive transfer learning; convolution neural network; multi-channel feature fusion; Sonar image segmentation","Article","Final","","Scopus","2-s2.0-85124737080"
"Li Q.; Zorzi S.; Shi Y.; Fraundorfer F.; Zhu X.X.","Li, Qingyu (57208661005); Zorzi, Stefano (57214136113); Shi, Yilei (55495784300); Fraundorfer, Friedrich (8977349800); Zhu, Xiao Xiang (55696622200)","57208661005; 57214136113; 55495784300; 8977349800; 55696622200","RegGAN: An End-to-End Network for Building Footprint Generation with Boundary Regularization","2022","Remote Sensing","14","8","1835","","","","12","10.3390/rs14081835","https://www.scopus.com/inward/record.uri?eid=2-s2.0-85128864677&doi=10.3390%2frs14081835&partnerID=40&md5=f45c09e07a84e47879c94d458f593cb7","Accurate and reliable building footprint maps are of great interest in many applications, e.g., urban monitoring, 3D building modeling, and geographical database updating. When compared to traditional methods, the deep-learning-based semantic segmentation networks have largely boosted the performance of building footprint generation. However, they still are not capable of delineating structured building footprints. Most existing studies dealing with this issue are based on two steps, which regularize building boundaries after the semantic segmentation networks are implemented, making the whole pipeline inefficient. To address this, we propose an end-to-end network for the building footprint generation with boundary regularization, which is termed RegGAN. Our method is based on a generative adversarial network (GAN). Specifically, a multiscale discriminator is proposed to distinguish the input between false and true, and a generator is utilized to learn from the discriminator’s response to generate more realistic building footprints. We propose to incorporate regularized loss in the objective function of RegGAN, in order to further enhance sharp building boundaries. The proposed method is evaluated on two datasets with varying spatial resolutions: the INRIA dataset (30 cm/pixel) and the ISPRS dataset (5 cm/pixel). Experimental results show that RegGAN is able to well preserve regular shapes and sharp building boundaries, which outperforms other competitors. © 2022 by the authors. Licensee MDPI, Basel, Switzerland.","building footprint; generative adversarial network; regularization; semantic segmentation","Article","Final","All Open Access; Gold Open Access; Green Open Access","Scopus","2-s2.0-85128864677"
